[
    {
        "id": 1,
        "tableId": 1,
        "name": "id",
        "type": "INTEGER",
        "length": null,
        "allowNull": false,
        "default": null,
        "comment": null,
        "isPrimaryKey": false,
        "autoIncrement": false
    },
    {
        "id": 2,
        "tableId": 1,
        "name": "fieldname",
        "type": "STRING",
        "length": 255,
        "allowNull": false,
        "default": null,
        "comment": null,
        "isPrimaryKey": false,
        "autoIncrement": false
    }
]
